{
  "status": "NOT_FOUND",
  "source_id": "tool:77b0e2d1",
  "tool": "sop_kb.retrieve",
  "trace_id": "tr-9a42",
  "server_time": "2026-10-22T09:02:14+07:00",
  "data": null,
  "errors": [
    {
      "code": "NOT_FOUND",
      "message": "Không có quy trình đã xuất bản cho mã sự cố này.",
      "retryable": false
    }
  ],
  "missing_fields": [],
  "provenance": [],
  "data_origin": "synthetic"
}
