{
  "status": "OK",
  "source_id": "tool:3c9e1b7a",
  "tool": "technical.get_active_outage",
  "trace_id": "tr-9a41",
  "server_time": "2026-10-22T09:02:11+07:00",
  "data": {
    "outages": []
  },
  "errors": [],
  "missing_fields": [],
  "provenance": [
    {
      "source_system": "service_interruptions",
      "source_version": null,
      "retrieved_at": "2026-10-22T09:02:11+07:00"
    }
  ],
  "data_origin": "synthetic"
}
